review,title,rating,date,size,color
"The shoe is comfortable but after wearing for 6 months the tread of the shoe is completely gone and the air pockets are sticking out of the bottom of the shoe. I just wear them casually, no sports or activities that would increase the wear of the shoe. Very poor quality for the price.",Poor quality,1,1/1/24,10,Cool Grey/Anthracite-dark Grey
The shoes that I bought were advertised not as used but upon receiving them they were very much used scuffed up and poor quality,Don't buy from this seller.,1,1/19/24,10,Cool Grey/Anthracite-dark Grey
Air pockets blew out within a month. Contacted seller and got no response.,Dissatisfied,1,11/23/23,9,Black/White/Anthracite
Both shoes have minor creases and scuff marks/blemishes all over leading me to believe they have been worn before.,Never been worn?,1,10/19/23,12,Black/Black/Black
Had theses for 1 day over 2 months and the right shoe air bubble is popped! I wear for morning dog walks that’s it. It’s bs!,Had for 1 day over 2 months,1,9/4/23,7,Cool Grey/Anthracite-dark Grey
I have ordered three of the exact Nike Air Zooms over the last year and the heel air pocket has collapsed on all pairs. The last pair last less than three months.,Air pocket collapse,1,8/12/23,10,Cool Grey/Anthracite-dark Grey
"The shoes feel and look nice. Unfortunately the quality of the sole does not live up to expectations. After years of using ASICS, I bought my first Nike again, and am thoroughly disappointed. After running only 60 miles or so, the one heal is through, and the other almost. Sadly I only noticed after the 30 day return window was passed. BTW, if you order from Nike, you will get a 60 day return window. Fail on Nike for the poor quality, and fail on Amazon for not offering the same return policy as Nike.",Not for running!,1,10/19/22,13,Black/White/Anthracite
"I understand these aren’t brand new 2022 air maxes- but when I spent $280 on these shoes I expect them to be perfect and last awhile. The sole of the shoe “popped” 2 weeks after buying them. It must have been a seem. The seller told me to take them to a Nike store because they would be under warranty- wel let me tel you if you purchase from a 3rd party company- they do not honor the warranty because they weren’t purchased directly through Nike- even though we’re paying the same amount. Save yourself the TIME and MONEY, but from a Nike Store. NOTE: the seller finally accepted a refund- just ridiculous though!",Product was defective,1,4/8/22,9,Black/White/Anthracite
These shoes I ordered were the last pair in my size and of course someone had been wearing them for a good little bit of time cause both shoes had worn soles and were already leaning. Totally disappointing,Worn out,1,5/23/23,9,White/Dark Grey-wolf Grey
It took almost two weeks for these to arrive and when they did they came without a box or anything else that comes with new shoes and look like they have been worn before.,Came without a box and look worn!,1,5/12/23,13,White/Dark Grey-wolf Grey
"Did not last long, bought another pair of running shoes with out the air.",The air pockets popped first week of use,1,8/31/23,12,Black/Black/Black
Is there less than a star I could give to this product and especially the Seller GoodSports Outdoor ?,GoodSports Outdoor - didn't admit this was a bad product and blamed me on excessive use. Amazon returned my money.,1,11/10/17,10,Black/Anthracite/White
"Shoes blew a heel, seller hasn't responded.  Buyer beware, these are horribly overpriced",Wore out super fast,1,7/31/23,13,Black/Black/Black
"Walked around for one week and the air part blew out. I spent almost $200 on these shoes. This is absolutely horrible. They’re good looking shoes and I love air maxes, but it is what it is.",The heel blew out 1 week into owning,1,4/13/23,10,Cool Grey/Anthracite-dark Grey
Shoes came in a damaged box with a rubber band holding the box shut. Shoes looked worn and used. Would not buy again.,Used shoes,1,6/10/23,12,Cool Grey/Anthracite-dark Grey
"I purchased a pair in 2022, first day my husband wore his shoes his feet smelled, and his feet don't smell! All he wears are Nikes’.  Makes me wonder if these are real. Now I must by Dr. Scholl’s",DON'T BUY,1,3/15/23,9,Black/White/Anthracite
The air popped on the bottom of the shoe. The right shoe is now unleveled and cannot be worn and stable.,These shoes barely lasted over 6 months,1,6/5/23,7,Wolf Grey/Black/Pure Platinum
"Never worn outdoors and only used on treadmill a few time per week. Within a few months the heal has worn through to the air pocket. Extremely unhappy with this product.  Is there a defect or something, as I never had issues like this before",Bad ware on treadmill.,1,12/24/22,11,Cool Grey/Anthracite-dark Grey
"Squeaking noise when walking, sounds like the internal air pockets in the bubble came loose and was rubbing against each other causing the issue",Loud Squeaking noise.,1,3/15/23,9,Cool Grey/Anthracite-dark Grey
AirMax Logo is ruined on the left shoe and fine on the right one,AirMax Logo is ruined before arrival,1,4/29/23,13,Black/Black/Black
IM BEYONG FED UP. THIS IS THE 2ND TIME I ORDERED SNEAKERS.....FIRST TIME I THOUGHT WOW THIS SUCKS MAYBE IT WAS A MIX UP.....BUT COME ON NOW A SECOND TIME ORDWRING AND THE SNEAKERS LOOK LIKE THE IMAGE BUT LEGIT PURPLE (INK) & GREY....I ORGINALLY ORDERED THE ALL BLACK.... DONT WAIST YOUR TIME.,BE WARE!!!! DO NOT BUY!!,1,8/8/22,10,Cool Grey/Anthracite-dark Grey
My husband loved these and I was so excited to buy them but they never showed. I emailed the seller before purchasing to ensure the color was available but I never heard back and once they never arrived I figured it was a loss cause.,Never showed up,1,8/24/22,11,White
They were advertised as new yet the box is torn up and look old. The shoes look like they are used because someone has already been walking in them making the upper material of the shoes creased and he bottom of the shoes are scuffed up.,Send them back not worth buying.,1,6/13/22,8,Cool Grey/Anthracite-dark Grey
Barely wore them for 2 days and both have a horrible squeak and they feel completely flat.  Customer service was non-existent so I sent them back for a return.  AVOID THESE SHOES!,Worst shoes I've ever owned,1,9/28/22,11,Cool Grey/Anthracite-dark Grey
I bought these for my husband because he loves Nikes and has a ton of them. He love them but has barely worn them and they already broke. They pop the other day when he was wearing them or maybe the 10th time.,Don’t buy these!,1,5/19/22,11,Cool Grey/Anthracite-dark Grey
They came with a little dents on one of them near toe. When I put on you can’t see . They are a little bulky for me but look good with jeans . The gray is starting to look like silver which is why I have only wore them twice.,Little bulky for me,1,2/25/22,10,Cool Grey/Anthracite-dark Grey
The “midsole” won’t hold the air pressure inside it.,Shoes are very poor quality,1,9/13/22,8,Cool Grey/Anthracite-dark Grey
"Very unsatisfied, I received the sneakers with a taped up Nike box that was completely damaged. I took the sneakers out of the box and notice the bottom has dirt on it. The toe top of the sneaker is all creased. I come to figure out that these sneakers have already been worn. I was under the influence that I was purchasing new sneakers. I did not want to buy used sneakers, especially in the time of covid 19.",Sneakers were used before I got then,1,4/29/20,15,Black/Black
Recieved these shoes july 27th only used them for work. Im in the medical field and on my feet for 12hr shifts. Last month the left heel air cushion blew out and nike will not replace them. I have numerous pairs of these exact shoes that are years old and still that has never happen. Im done with Nike products. Don't waste hundreds of dollars.,Very disappointed,1,10/20/20,12,Black/White/Anthracite
Unfortunately after having them a month the right shoe went flat. I hope the seller can contact me and help. Very disappointed. And I had only wore them a few times. 😩,Went flat after a month,1,6/22/22,9,Cool Grey/Anthracite-dark Grey
 Did not like purchasing a used product for a brand new price!,Sold a USED product for a NEW Price,1,3/29/23,9,White/Dark Grey-wolf Grey
"At first these were amazing and was happy, 7 months later, worst pair I’ve ever bought. 10months later completely useless. My last pair of air max I bought in 2010 and lasted until March 2016. I bought these last April, soles are completely gone and both air pocketcs have popped. I only wear them to work and take great care of them, which why my last pair last 5 1/2 years. Yes YEARS!! Not months like these. Please refund these or send me a new pair idecitally!! Very pissed off/frustrated/upset customer!!!","Started out nice, worse pair ever; 10 months later.",1,1/21/18,12,Black/Black/Black
"The air support was punctured after wearing one time . Now it has no support , and rolls my ankle with every step .",Air support was punctured after one use,1,11/30/22,12,Cool Grey/Anthracite-dark Grey
I bought these for my 12-year-old son and within one week the soul of the shoe had completely ripped off—the plastic was completely falling off.,Terrible low quality cheaply designed,1,8/26/22,10,Black/Anthracite/White
I've had these for a little over a month and they are very worn and the air is gone with no punctures! Absolutely horrible!!!,Worst shoes I've ever bought!!!,1,10/25/22,10,Cool Grey/Anthracite-dark Grey
These Nike shoes popped after 5 wears! We were very disappointed. They were a gift for my adult son! We wanted a refund or a new pair!,They broke after 5 wears ? The heal air popped,1,7/1/22,13,Black/Black/Black
Looked nice and felt comfortable - that is until the left shoe’s air bubble popped. What a wasteful design.,Air bubble popped in 45 days,1,9/26/22,8,Cool Grey/Anthracite-dark Grey
I had to return the sneakers because the antitheft tag was still on the shoes smh.,Stolen,1,9/28/22,7,Cool Grey/Anthracite-dark Grey
The shoes are cut very narrow,Shoes are cut narrow!!,1,1/7/23,12,Cool Grey/Anthracite-dark Grey
"Wrong size, terrible quality, waste of time and money, only thing I got was another chore.",Don’t buy,1,9/16/22,7,Cool Grey/Anthracite-dark Grey
 After a month of wearing theses shoes the heels went flat and started to squeal. Very annoying every time I walked,Goes flat,1,8/22/22,10,Cool Grey/Anthracite-dark Grey
Looks like the shoe is falling apart and I just received it. Looks like they tried to glue it? Disappointed with quality,Glue was coming apart,1,7/27/22,10,Cool Grey/Anthracite-dark Grey
I thought i was getting all whit pair and i got grey fading to white🤷‍♂️,Not the color i expected,1,8/5/22,12,White
I didnt even get a solid month out of these shoes before the air bag popped. Waste of 200$,Wore these shoes for 1 month 3 to 4 days a week and the air bag has already blown out.,1,6/9/22,13,Black/White/Anthracite
The sole pops easily. Don’t waste your money. I wore this 5 times and the bottom popped  Can’t return it or use warranty.,Bad design,1,3/29/22,9,Black/Black/Black
 Had shoes two months went flat on the right and left hand side heel on both shoes $200 to last for two months,Not worth it,1,11/25/21,12,Black/Black/Black
Shoe was over priced. It was defective. The air max cushion got deflated within few weeks. I returned the shoe. The seller charged me 170$ restocking fee!?? I detailed all that to the seller in a letter with my return.,Don’t think it is fair,1,8/6/21,12,Black/Black/Black
Shoes were worn within one month of normal use. The air shocks are already poped.,Wearing very quickly,1,8/31/22,10,Cool Grey/Anthracite-dark Grey
Bad quality,The books this part is too weak not usable not work one month,1,10/22/22,10,White
These shoes were supposed to be new but they came used. So disappointed especially after paying so much. What a disgrace.,New shoes came used,1,11/17/21,10,White
Received these in the beginning of November. They do not even have 160 miles on them. Very disappointed in the durability of the shoe. Would like a refund or at least a credit towards a better product.,Not Durable,1,1/18/20,8,Wolf Grey/Dark Grey/White
"They came popped  ,",Defective .,1,12/24/18,9,Black/Black/Black
Air blew out during 2nd use.,Left shoe air blew out 2nd time I wore them.,1,7/1/22,11,Cool Grey/Anthracite-dark Grey
I have used these strictly for running. I have used them maybe 6 times. One of them has already completely deflated. I expect way more for a 190$ pair of shoes. Universal has not responded at all to my questions. Would highly recommend not buying these shoes or dealing with the sellaer,Don’t buy,1,12/30/17,9,Black/White/Anthracite
Right shoe has zero support.  I only wore these shoes twice and the right dhoe sir cell does not hold air.. terrible and expensive . Dont buy these,Unsatisfied,1,3/26/20,9,Cool Grey/Anthracite-dark Grey
Don’t buy these shoes. The right one popped a month after I bought them. What a waste of money.,HORRIBLE PRODUCT,1,11/5/20,7,Wolf Grey/Black/Pure Platinum
The show didn’t fit right,Shoe didn’t fit right laces were too short could barely tie them,1,4/18/22,12,Cool Grey/Anthracite-dark Grey
Thought I will give another try,Definitely not worth the money.,1,2/23/20,7,Black/White/Anthracite
Lasted about 1 and a half month then right rear air system sprung a leak now shoes are useless,"Air leak in rear of shoe right side, shoes are use less now",1,5/5/20,9,White
Unfortunately the received product was not properly made,Product is irregularl and damaged,1,4/3/22,12,Black/Black/Black
 Not happy with purchase material is discolored like it sat in the sun for a year the black has purple tint,Faded,1,8/1/21,12,Black/Black/Black
To Big not a 10/12 I sent them back waiting on my refund??,The sneakers were too big!!! Not a 10/12!!!! I send them back I’m waiting on my refund??,1,10/6/21,10,Cool Grey/Anthracite-dark Grey
"I loved this shoes for about two weeks. Then lost air in one, not sure how the air got out there are no punctures in the air bubble.",Good for 2 weeks,1,10/11/19,10,Cool Grey/Anthracite-dark Grey
We had these less than 3 months and the air shock already popped,Didn’t last,1,6/2/20,14,Black/White/Anthracite
Right shoe went flat after two weeks of wearing!,Right shoe went flat after 2 weeks of wearing!,1,12/6/21,12,Black/Black/Black
Did not even try them all on they were damaged on arrival don't even know how you could sell this at a price like that product look like crap,Horrible,1,2/17/19,12,Cool Grey/Anthracite-dark Grey
Shoes became defective 2 weeks ago. One of the heel chambers became flat. Havent had them 4 months. What a waste of money,Defective after 4 months,1,9/23/19,8,Bright Crimson
"Did not fit. It had a band in it, makes it hard to get your foot in.","Did not fit. It has an elastic band in side, makes it hard to get your foot in.",1,7/29/19,8,White/Dark Grey-wolf Grey
These shoes must run very small!!  They are too painful to wear. I wish they could be returned.,Careful these run small!!,1,1/17/18,10,White
Support bubbles popped on both shoes within 2 weeks of normal wear.,Poor quality,1,5/7/19,13,Bright Crimson
"The Shoe fit as expected, however the shoe popped a few days later. Not happy about that.",Not happy about that,1,7/18/17,10,Black/Anthracite/White
Really bad shoes,I don’t think this shoes are being manufacture by Nike,1,2/24/20,9,Black/Black/Black
Wrong color and wrong size.,One Star,1,6/29/18,9,White
The color was completely different then what was stated in the description,Wrong color,1,6/20/19,10,Cool Grey/Anthracite-dark Grey
Loose material on the shoe. Looked very cheap. Returned for refund.,Don’t buy.,1,3/11/19,10,Cool Grey/Anthracite-dark Grey
Horrible fit,Dont order it,1,2/4/19,9,Cool Grey/Anthracite-dark Grey
Squeeks. Makes noise.,Squeeks.,1,2/5/19,9,Black/Black/Black
Air nikes popped already. So disappointed,Useless,1,11/21/22,10,Cool Grey/Anthracite-dark Grey
I returned this product the same day that I received it as it was delivered to me in an old torn box wherein the shoes looked to have been worn. The soles were discolored with an appearance of wear and tear. Shoes looked used but were sold as if they were new.,Shoes appeared to have been worn & received in an old torn box,1,12/1/22,13,Bright Crimson/Black
"My son is in high school and has only wore these shoes for a week at school and the sols are already coming apart , after almost spending 200 on them this is unexceptional and will be getting my money back !!!",Wore 2 weeks only to school and the shoe is already falling apart ! Will be getting a refund,1,8/29/22,11,Cool Grey/Anthracite-dark Grey
These shoes are supposed to be some of the best.  I bought them.  Expensive.  Barely used them.  Except for working out in the gym.  And my left air pocket popped and I almost sprained my ankle.  Tried contacting this company and they havent responded. Amazon will not do anything for me. They told me to go to the manufacturer to take advantage of the warranty.  But Nike won't honor the air pocket lifetime warranty. I'm pretty discouraged by all 3 companies right now.  Not one will do anything. Don't buy these shoes.,Defective shoes.  Amazon won't back the company either that theyve allowed on their site,1,9/7/20,9,Black/White/Anthracite
There is no reason that these shoes should cost this much. Order Nike shoes through a different source. These shoes will fall apart quick.,Not worth the money,1,4/21/22,12,Black Grey
"Not what they used to be , feels like walking around on bricks",Not comfortable,1,5/4/22,12,Black Grey
Send me new one,No good expensive shoes no goog quality,1,6/13/22,8,Black/Anthracite/White
"I bought these for work where I may have to run around in a hurry. They look beautiful and feel comfy, however after 10 weeks of using them the grip on the bottom has almost worn through and I'm close to reaching the air bubble.","Looks good, just don't go running too much in them.",2,8/21/23,8,White
Did not hold up for the price!  The air cushion blew out in the first 2 weeks.  Very disappointed,Poor quality,2,8/24/23,13,Black/Black/Black
"After 3/4 weeks of use, these shoes are squeaking very bad, both of them, I don’t think I can use them anymore since everybody is looking at me when I’m walking or running, very dissapointed.",After 3 weeks these are squeaking badly,2,7/7/23,9,Cool Grey/Anthracite-dark Grey
Unless you are planning on staying on a treadmill with these I would not recommend them. The second time wearing these I brushed up against a curd on my way to a track meet and pop. So lamé probably last time buying Nike for my family of 5 .,Fragile,2,4/28/23,12,Black/White/Anthracite
I just bought them for my husband not long ago and the air pocket popped already!,Popped,2,7/23/23,9,Cool Grey/Anthracite-dark Grey
Didnt have these long at all the exposed bubble on the bottom got pierced with a stick for the money these didnt last as long as id like went to dicks and got a 80$ pair of airs that have outlasted them by much longer,Popped in 5 ish months,2,4/2/23,12,Black/White/Anthracite
Dont wear when lifting weights as it will pop the air pocket of the shoe. Great for running but not lifting weights . After 2 months left right air bubble on shoe popped. Was going to get another pair in a different color until this happened.,Great for running but not liftingweights.,2,3/4/23,9,White/Dark Grey-wolf Grey
I’ve owned many 360s. Something is off on these. Nike reject shoe maybe. But both squeak and the laces are too short,Something’s off,2,5/19/23,10,Cool Grey/Anthracite-dark Grey
"Nike has a great brand with he quality of products, however in this case the shoe started squeaking three months after purchase. I was told it was because of manufacturer defaults which is disappointing.",Great at first,2,2/7/23,9,Black/White/Anthracite
"The shoe looks great, fits great, but after the break in period shoe material begins to squeeze and shift while walking. I no longer run in them in  fear of rolling my ankle. It looks nice but i feel it is no longer safe to long distance run in. Of course these defects show up after I'm able to return them so I'm stuck with a $200+ walking shoe. Some may pay these prices for fashion but I only took a chance and paid this price for the results advertised.",Expensive for results,2,5/19/21,12,Black/White/Anthracite
shoe look used,dont like color,2,5/26/23,9,Cool Grey/Anthracite-dark Grey
"I have always been a big fan of the Nike air max, I bought these 5 months ago and for 3 months of that I had knee surgery so couldn't even wear them between being bed ridden and crutches.  So I've essentially wore the shoes for 2 months and the air pocket on them had a leak so I literally had a flat tire.  These are the most comfortable shoes ever until you get a flat tire.  For paying over 100 bucks for a pair of shoes you think you should get a lot more out of them.  I bet they wouldn't of lasted a week if I was a runner.  It is possible that I got a lemon pair and hopefully that's the case.",These are the most comfortable shoes ever until you get a flat tire,2,7/17/18,12,Black/Black/Black
Don’t buy. They make a squish sound when you walk.,Not worth it,2,3/15/23,13,Black/Black/Black
The bubble on my right shoe got flat within 4 months of normal use. Nike has a two year warranty but have to go thru seller. This seller did not help with warranty.,Bubble got flat  whiting 4 months,2,10/19/22,9,Cool Grey/Anthracite-dark Grey
The shoe seems to be much smaller than they say. They are really tight around your feet. The shoes look good but as for fit they are a no go.,Too Tight,2,10/3/22,10,Black/Anthracite/White
Great design. Left shoe has wrinkle on the fabric. Not the best fit. Pegasus shoes are much better and supper support. Not worth the price.,No the greatest fit. Pegasus shoes are more comfortable,2,10/7/22,9,White
" The left sneaker collapsed,  the cushion in the heal lost the air.  Only 2 months","The left sneaker collapsed,  the cushion in the heal lost the air.  Only 2 months",2,8/3/22,9,Black/White/Anthracite
 Looks like they been worn and put back in the box..,Looks used,2,10/30/22,9,White
"I’ve bought tons of Nike sneakers and they come a pretty standard way. These sneakers almost had a feel as though they were refurbished. For examples the shoes were laced up with some shoelaces that barely fit. Seems random but this little detail has my spidey senses tingling. I’m kinda of feeling as though I should have spent the extra $10, $15 and bought from a legit store.",Something about these sneakers seems off,2,5/26/19,9,Bright Crimson
I always love my Nike air max but this purchase has been disappointing. Less than 2 months of use and both the airs popped which makes it feel like you wobble n unbalanced. There has to be a defect or something but for that money last a few months not two.,My favorite shoes and they popped after 3 months,2,1/15/20,12,Bright Crimson/Total Crimson/Black
Sneakers came and looked nice when they came but when I took them out and looked at them I notice a mark in the air bubble at first thought it was glue or something but it wouldn't rub off thought it was a crack but air does not leak out you pay a price like this for sneakers you expect them to be perfect,Sneakers came and looked nice when they came but when I took them out ...,2,5/13/17,10,Black/White/Anthracite
"Shoe blew out....  other than that, all good",Blew OUT!!!,2,4/19/19,9,Cool Grey/Anthracite-dark Grey
Color is off,Ok,2,1/14/20,11,White
The shoe is to tight,Tight,2,8/8/19,10,Cool Grey/Anthracite-dark Grey
Running,The heel pop,2,7/21/19,8,Wolf Grey/Dark Grey/White
Overpriced,Overpriced!!!!!!!!,2,10/11/23,13,White
"I'm not a shoe ""specialist"" by any means, but my second pair (of the exact same color/style) of this shoe. Felt cheaper in quality. The padding felt non-existent, no ""squishy"" from the Air-Max, and the insides are not as comfortable. Just my opinion.",2nd Pair Owner,2,8/11/23,10,White
With real nikes you can send them back to nike if the bubble bursts.,Bubble burst,2,4/30/22,13,Black/White/Anthracite
The grey isn't near as dark in person. Online it appears almost black but in person it's just a dirty grey color. Not keeping.,Much lighter in person,2,4/13/22,7,Cool Grey/Anthracite-dark Grey
The sneakers are not original,The sneakers are not original,2,6/10/22,11,White
I didn't like where the tags for the shoes where located at.  seems like the shies might be fake or something with the tags sewn onto the sole.,tags in suspious area,3,1/7/24,13,Black/White/Anthracite
Shoes are amazing! Amazon offered a partial refund for the missing box,Where is my Nike shoe box?,3,2/15/23,12,Black/Black/Black
Too big,I’ve been wearing a size 10 Nike for 30 years. This was a size and a half to be.,3,3/27/23,10,Cool Grey/Anthracite-dark Grey
"Really comfortable and good fit. However the air bubble popped after 6 months of light use, did not wear daily.","Felt Great, Air Bubble Popped",3,8/9/22,9,Black/Black/Black
Sneaker received was dirty and show was defected,Seems like these are defected sneakers and were soiled,3,10/6/22,13,Cool Grey/Anthracite-dark Grey
"The bladders delate after a dew days of normal wear, had them replaced, same thing happened to the new pair.  I would not recomend buying these unless u don't walk or stand, otherwise u will be walking on goodlooking shoes with popped bladders.",The air bladders are week and delate after few days of normal use,3,10/17/21,11,Cool Grey/Anthracite-dark Grey
"I have numerous pairs of this shoe, but as I have read in other reviews the shoe fits tight.  I can usually add my orthopedics, but not this time","Cute shoe, but the top of the foot area to tight",3,8/18/21,7,Cool Grey/Anthracite-dark Grey
"I wanted the shoe to be predominantly White, it is not, it's mostly Grey","The shoe is more Grey, then White",3,9/24/21,12,White
