review,title,rating,date,size,color
"These run a bit narrow and the standard 45"" shoelaces were too short to allow adjustments. I tried both 48"" and 54"" shoelaces, and the 54"" worked best. I own many pairs of Nike Air Max shoes, and these are the first ever to have this issue.","Narrow, shoelaces short",3,6/30/17,10,Black/White/Anthracite
Fantastic shoe only I got a defective pair where the right shoe makes a terrible squeaking noise with every step...literally every single step.,***Great shoe for the price***,3,4/17/20,11,White
More narrow than the typical Nike fit.  The shoe looks awesome but is very snug.,More With Needed,3,12/5/19,12,White
Was not happy with the color expecting the off white came in a off blue grey. The fit comfort and how my foot feels is awesome.,Was not happy with the color expecting the off white came in ...,3,2/14/18,9,White
"They look comfortable, but they really aren’t",Looks can be deceiving,3,9/27/19,10,White/Dark Grey-wolf Grey
"didn't like the color, it was actually way darker.",Three Stars,3,4/21/18,9,Cool Grey/Anthracite-dark Grey
"Cost 245.00, insane, insane bout airmax",Pricey,3,6/8/17,13,Black/White/Anthracite
NORMAL WEAR AND THE RIGHT AIRBUBBLE WENT. I HATE WHEN THAT HAPPENS!!!!! $200 FOR 6 MONTHS. UGHHHHH,"LOVE THE SHOES, BUT AIR BUBBLE POPPED AFTER 6 MONTHS.",3,7/27/23,12,Cool Grey/Anthracite-dark Grey
Look I love Air Maxes. And loved the feel and style of this model. But I’m about tired of the air pockets popping within a year after spending $200 on shoes. This is not the only model it’s happened to me with. But damn sure happened with these too.,Meh,3,11/11/22,9,White
The Price was Nice. Look good. But the name People Loove to have timeless items. But to be 7 years later puts the name as just Old when the kicks be new. So judge is All up to u. I jumped w/no thought. I think it hit the spot as they are not 4me to wear... Hard to love footwear another got 4u. Till u wear awhile.. They Do look their Part. They look Great felt better =out the mouth of a 6 foot 6 inch stocky man! Put up for a better day.. GETEM wile they Hot..or gone you may Have to climb another tree.. Find a Diff set of these..,The 2017 model will it put you Mind B4 covid or Remind of it?,4,1/13/24,15,Black/Black
Nice quality shoes.,Quality shoes,4,1/2/24,9,Binary Blue/Black-obsidian
"The Nike Air Max 2017 Men's Running Shoes are a great option for people looking for comfortable and stylish shoes. The shoes feature a sleek and modern design, with a breathable mesh upper that allows for maximum airflow and keeps feet cool and dry. While it's coined a ""running shoe"", I don't think this would be a great shoe for serious runners. To me, it's better labeled a ""casual shoe"". Two reasons for this:",A great casual shoe,4,1/18/23,10,Cool Grey/Anthracite-dark Grey
"i am 47 and a life long Nike wearer.  While i like the look and feel of these shoes as i would expect from my previous years of experience with Nike, they are very squeaky.  The fit is perfect but the slight movement of my feet within the shoe causes them to squeak.  I thought this would go away once i had them broke in but i worn them for 5-6 days a week at work and play for a couple months but the squeak continues.  I am going to have to give up on being sneaky any time i wear these.",super squeaky shoes,4,6/28/23,10,Cool Grey/Anthracite-dark Grey
For being almost 200 bucks you would think they would've been more comfortable.  I had to spend another 35 bucks on insoles just so I could wear them.  They look cool though and maybe that's all Nike is about.,Overpriced,4,6/27/23,11,Cool Grey/Anthracite-dark Grey
I received the shoes and they look nice. I have yet to wear them. The shoes arrived in just a few day. They look very comfortable.,Pleasing to the Eye,4,2/28/23,13,White
"I ordered all black and got a gray Nike symbol instead. Other than that, so far they seem legit. I really don't have a complaint at the moment, they seem to have no holes in the air pockets and they aren't falling apart like some said. Perhaps a bit of time worn will change my opinion, but I looked them over scrupulously after seeing more reviews. No complaints on my end other than the color.","Not exactly what I ordered, but I'm not terribly disappointed.",4,7/27/22,9,Black/Black/Black
Air max lost air after 3-4 months. Bubble popped. Bubble is exposed on bottom of shoe so after a few months normal wear and tear right shoe is ruined. Paid about $100 per month. Ridiculous for the amount they cost I expected to have for years.,Bubble popped after a few months. Right shoe is ruined. For almost $300 terrible value!,4,9/15/22,14,Black/White/Anthracite
I have been buying the same shoe with different colors (presently I have 7 pairs).  Is this shoe the best for everyone?? NO.  I run about 4 miles a day and it provides great support,It is the right shoe for my foot,4,7/18/22,9,Cool Grey/Anthracite-dark Grey
They were to tight,I love the shoe there just to tight,4,9/24/22,12,Black/White/Anthracite
"Love the look, and they’re fine for hanging out but any extensive running (or even long walk) would be better served with a real running shoe.",Running shoe style - bit I wouldn’t log miles in them.,4,6/27/22,11,Black/Anthracite/White
"It's a good shoes, just as what I expect from usual Nike air max series.","good shoes, but I need to adjust my shoes tongue",4,2/25/19,9,Cool Grey/Anthracite-dark Grey
I could tell from wear on the bottom of the shoe that they we not brand new as listed.  Also they did not come in the original packaging.,Product was not listed at truly new,4,6/29/20,12,White
"Been a long time user of Air Max shoes.  The sole has changed though and wear very fast.  Normally I get 10-12 months.  With the new sole, they only last about 6 months before the sole wears too much and air sole pops.",Been a long time user of Air Max shoes. ...,4,3/5/18,13,Black/White/Anthracite
This is my second pair in The last four months. The first pair lost the air with in the soul of my right shoe and was very uncomfortable. I thought I would give the shoe one more try because when it was correct it fit and felt great that I would order it again.,Second chance,4,4/15/17,11,Black/White/Anthracite
There was a stain on the shoe that cannot be removed. Other than that good,Stain,4,10/2/19,8,Wolf Grey/Dark Grey/White
Great shoes. Comfy but the only thing is that (and I heard it from other nike owners) they really don't lust long. and too high of a price.,Great shoes but price is too high!,4,7/21/17,11,Black/Anthracite/White
Nike as expected well made shoe.,Nike never disappoints!,4,1/12/20,8,Wolf Grey/Dark Grey/White
Good job bro,Good job bro,4,3/30/20,13,White
It is a little stiff at the beginning...,Get them 1/2 size bigger.,4,7/30/19,8,Cool Grey/Anthracite-dark Grey
Pricey but ...,Pricey,4,2/29/20,9,Black/Black/Black
Comfortable.,Nicd shoes Air Max,4,7/21/19,8,Cool Grey/Anthracite-dark Grey
Somewhat small.,Not satisfied !!,4,6/3/19,12,Cool Grey/Anthracite-dark Grey
The color looks more orange in person,Great quality and fits well,4,3/22/19,12,Bright Crimson/Total Crimson/Black
they get the job done for standing or walking a lot,Four Stars,4,6/4/17,10,Black/White/Anthracite
All good,They look and fit as expected,4,3/27/19,12,Cool Grey/Anthracite-dark Grey
Ran smaller than my last air Nikes!,Four Stars,4,12/17/16,11,Black/Anthracite/White
Very nice,Four Stars,4,10/28/17,11,Black/White/Anthracite
Excellent for job that requires a lot of physical activity.,Go for work that requires a lot of physical activity.,4,1/31/21,14,Black/Black/Black
Christmas present,NeedNeedy Christmas present,4,12/14/22,10,Cool Grey/Anthracite-dark Grey
My last three pair have all been exactly the same. So yes I like them.,My shoes,5,1/18/24,10,Black/White/Anthracite
These shoes fit so well and I can't wait to purchase again in another color.,Best Buy Ever,5,1/18/24,13,Black/Black/Black
They fit perfect. They are really light and comfortable. I would buy these everytime I need new shoes!,Best shoes I've ever owned,5,12/31/23,10,Pure Platinum/White-black
Best walking shoe I've found!,Highly recommend,5,1/5/24,8,Black/Anthracite/White
I like this shoes,Good,5,12/19/23,7,White
I just love air max in general. Comfy and fit great,Great,5,12/13/23,11,Pure Platinum/White-black
My husband has gigantic feet. He has a wide foot and can’t stand shoes that are tight around the toe area or where the laces begin. These shoes are his everyday sneaker. He loves and lives in these. He has a lot of other sneakers in his collection but always comes back to these for comfort.,Exactly what the doctor ordered,5,11/5/23,13,Black/Black/Black
"I’ve been wearing Nike for some time and have loved the lighter weight flyknit shoes. I had a pair similar to these and wanted something that might hold up to winter weather better. These seem like they will do the trick. The knit is a little heavier and more padded, which should keep out the cold. The bottom is the air bubble type, with a  layer of typical tread on the bottom. Very comfortable.",Comfortable and Heavier,5,10/24/23,7,Cool Grey/Anthracite-dark Grey
"Comfortable, fit great, good shoe",On time fit great,5,11/26/23,13,Bright Crimson/Black
Gift for my boyfriend was very pleased he loved them.  Great purchase,❤️,5,11/11/23,10,Cool Grey/Anthracite-dark Grey
"Very comfortable sneakers, the fit is perfect.",Nike sneakers,5,11/2/23,9,White
"Looks good , fits well, comfortable",Nice Shoe,5,10/15/23,10,White
exelent thanks,very nice,5,10/14/23,8,Black/Anthracite/White
I’ve had about 4 pairs of these since 2017. I use them almost daily! They are like walking on a cloud.,One of the best shoes ever made,5,7/17/23,9,Black/White/Anthracite
"After searching hi & lo for these trainers, luckily I was able to get these from USA and delivered to the UK. These are the most comfortable trainers I have ever worn. Definitely looking to order another pair, slightly a different shade of colour. I can now retire my old pair of the same Nikes I’ve had since 2018. The delivery was quick, only took 4 days to come.",Most Comfortable trainers,5,4/26/23,12,White/Dark Grey-wolf Grey
These were perfect!!,Exactly What I Wanted!!,5,9/19/23,10,White
Love these shoes!,Great shoe,5,9/15/23,10,Black/White/Anthracite
These shoes were ordered for my teen son. He loves them and they are of great quality!,Thumbs up,5,8/5/23,7,White
Only shoe I can use to run or walk in after multiple Achilles and knee surgery.,Best running shoe,5,8/2/23,13,Black/Black/Black
GREAT BUY,GREAT BUY,5,9/4/23,9,White
Fits comfy and looks cool. I feel like I'm walking on a cloud.,Pretty nice,5,8/3/23,8,Binary Blue/Black-obsidian
Great shoe. I’ve liked them since they first dropped.,Comfort,5,8/7/23,10,White/Dark Grey-wolf Grey
I like the shoes all the way around. They fit the way I needed them to and they’re so comfortable wow! Very light weight and your feet breathe through fabric. 10/10,Comfort,5,5/10/23,8,Cool Grey/Anthracite-dark Grey
Nice product,Very comfortable,5,8/13/23,14,Black/White/Anthracite
"This is my second pair, and I love them. Also, my feet thanks me too.😁",They are comfortable,5,6/26/23,13,Black/Black/Black
"Nice, very satisfied",Quality,5,8/3/23,7,Cool Grey/Anthracite-dark Grey
Awesome,Comfortable,5,8/4/23,10,White
Perfect,Perfect,5,7/16/23,11,White
"I really liked these sneakers but key word but, after receiving them the left sneaker toe was all dented then upon return received second pair and the right sneaker toe was dented . Don't know why this is . First time I received dented sneakers lol so I asked for a refund . Paying $170 for a pair of sneakers they should not be dented anywhere .",Dented toe twice,5,11/8/22,12,Black/Black/Black
Daily use,Super comfortable and still look good.,5,6/28/23,12,Cool Grey/Anthracite-dark Grey
Exactly what I was expecting.,Nice shoes,5,6/16/23,11,Binary Blue/Black-obsidian
"I actually bought the “used” pair. As stated, they were used like new and they were. Bottom of shoes were clean and so was the inside. The shoes are just what I was expecting. The only thing I don’t like is that the tongue is stitched to the shoe not allowing a full free open motion on it. Overall I’m happy with my purchase.",Awesome shoe!,5,10/13/22,10,White
Item was on time and as described,Nice shoes,5,5/21/23,12,Cool Grey/Anthracite-dark Grey
The shoes are perfect for running and calisthenics.,The shoes fit true to size and are a great buy for the price.,5,5/9/23,10,Cool Grey/Anthracite-dark Grey
Love these shoes. Very comfortable,Very nice,5,5/23/23,8,Wolf Grey/Dark Grey/White
I like everything about these shoes from the color and design.  They are also very comfortable.  They are lightweight and easy to get around in,I love these shoes!,5,1/21/23,8,White
Great shoe! Quick delivery! Great price!,Great shoe!,5,5/2/23,10,White
"Love the shoes. They fit with your normal size you wear. Be careful though, they do get dirty easy.",Shoes,5,1/28/23,13,White/Dark Grey-wolf Grey
Fit great,Very comfortable,5,5/6/23,9,White
Very comfortable and stylish shoes!!,Very comfortable,5,4/6/23,11,White
"Excellent choice, will buy again.",Good product.,5,3/30/23,10,Cool Grey/Anthracite-dark Grey
great.,vary comfee,5,4/26/23,13,White/Dark Grey-wolf Grey
These Mens Nike AirMax 2017 running sneakers in my opinion are the best sneakers on the market. Very supportive in the heal and arch area of your feet like standing on a cloud. Worth the money.,Best sneakers on the market and Worth the money. 👍🏻,5,8/5/22,11,Black/White/Anthracite
Great deal for the shoe just got it and so comfortable.,This is mad comfortable,5,1/18/23,7,White
I love this so much and very comfortable,Air max 2017,5,2/7/23,10,White
"Fit as expected, very nice shoes everything was on point","Perfect Nike's, I love them!!!!!",5,1/19/23,9,Black/White/Anthracite
The shoe looked exactly like the picture!,Sharp shoe!,5,2/4/23,10,Wolf Grey/Black/Pure Platinum
I bought these for my husband for his birthday,Happy Husband,5,4/23/22,10,Black/Anthracite/White
"The shoes are exactly what I hoped they would be, comfortable, fits nice and would purchase them again.",Comfortable shoe and meets expectations,5,11/16/22,13,Cool Grey/Anthracite-dark Grey
It's take a little longer to come than expected but it fit well and looks good.,It fits well as expected,5,11/15/22,8,Cool Grey/Anthracite-dark Grey
"Shoes were brand new,  exactly as advertised.  Would definitely buy from this seller again.  Love the shoes I couldn't find anywhere else!",Exactly as shown. Great Seller!,5,9/2/22,11,Cool Grey/Anthracite-dark Grey
Love that you guys sell Nike stuff,Came quick,5,12/21/22,10,White
I use them for everyday,I love them,5,12/24/22,10,Cool Grey/Anthracite-dark Grey
Great buy for tge money,Great buy for the money,5,12/21/22,12,Cool Grey/Anthracite-dark Grey
Perfect fit great shoes I love them,Great shoes great fit I love them,5,12/3/22,11,Cool Grey/Anthracite-dark Grey
"Very comfortable, nice shoe!","Very  comfortable, nice shoe!",5,12/16/22,10,Black/White/Anthracite
Not true to size,Not true to size,5,12/1/22,13,Black/White/Anthracite
Very nice shoes,Good Shape and very comfortable,5,11/30/22,12,Black/White/Anthracite
Great shoe. My third pair. Great price. I’m going to get another pair.,Comfortable,5,9/21/22,8,Cool Grey/Anthracite-dark Grey
I only wear men Air Nike for running - I have purchased this style of shoe for over 20 years,Great Running Shoes,5,5/31/22,7,Cool Grey/Anthracite-dark Grey
I bought these shoes for my husband and he loved it! He said they are comfortable and fit perfect.,They’re great!,5,5/15/22,8,Black/Anthracite/White
Came in Nike shoe box in brand new condition. I really like the shoes and would buy again.,Nike Air Max,5,5/17/22,11,Black/White/Anthracite
"Excellent product, plan to purchase more of the same style.","Excellent customer services, thank you.",5,9/17/22,9,Cool Grey/Anthracite-dark Grey
"Love how the air feels, great running shoe..","Fits true to size, wider feet might need bigger size or a different product..",5,10/2/22,10,Cool Grey/Anthracite-dark Grey
"Shoe arrived ahead of schedule, nicely packed.  Used for everyday footwear.  Thanks",shoe meets expectations,5,6/27/22,13,Cool Grey/Anthracite-dark Grey
I like the shoes. I use the shoes for styling just kosher chilling today!!,I like the shoes,5,5/10/22,12,Black/White/Anthracite
"love these shoes, item as described. hope they will last for a while.",NIKE AIR MAX 2017,5,5/16/22,7,Black/White/Anthracite
Excelent...,Excelent...,5,10/8/22,13,Cool Grey/Anthracite-dark Grey
Great for support for bad ankles,Awesome,5,10/5/22,11,Bright Crimson/Black
will by again,will buy again,5,9/20/22,8,Cool Grey/Anthracite-dark Grey
product delivered as advertised and on time,good quality,5,8/23/22,9,Black/Black/Black
I like how the feel I’m my feet. Very lite,Very confront able sneaker.,5,6/1/22,13,Black/White/Anthracite
The 2017 Nike Air Max has been my favorite shoe since I first tried them on. It has been hard to find those who are still selling these Air Max shoes and I am hoping that Nike continues to manufacture these continuously. These are probably the 8th pair I have purchased since they came out. Thank you for a great shoe!,Favorite Air Max ever!,5,2/8/20,10,White
These shoes are comfortable and nice looking,Beautiful and comfortable,5,7/3/22,10,White
Nice look,Comfortable,5,9/5/22,12,Black/White/Anthracite
Shoe fits to the tee.,Shoe Size,5,7/28/22,10,Cool Grey/Anthracite-dark Grey
Arrived on time and my husband loves them,nike sneakers,5,4/27/22,10,Black/Anthracite/White
I love this model because their easy on my back pain. I paid to much. But they don't make them anymore,Comfortable,5,8/6/21,10,Cool Grey/Anthracite-dark Grey
It's just what I wanted to replace my old ones.,Love them,5,3/8/22,11,White
Great pair of shoes,Love them,5,5/29/22,11,Black/Anthracite/White
I love my new Nike Air Max! They look like the pictures but fit and feel soo much better. They’re like walking on air. I would like to get another pair. Just waiting for them to become available. I hope you enjoy yours as much as I enjoy mine.,The new design really gives you the feeling of walking on Air Max!,5,1/23/20,10,Wolf Grey/Black/Pure Platinum
best shoe made,Walking On Clouds,5,6/7/22,13,Cool Grey/Anthracite-dark Grey
These are the most comfortable shoes i have ever worn.  I purchased 2 different colors to make sure i could keep them both clean and have the longest possible.,The best shoes i have ever purchased,5,12/22/20,9,White/Dark Grey-wolf Grey
Gym,💯,5,6/4/22,9,Black/White/Anthracite
"Great sneakers for working out, breathable and comfortable",Very good,5,12/29/21,9,Cool Grey/Anthracite-dark Grey
The price for these shoes is ridiculous,"I like the product,  ridiculous pricing for this item",5,2/2/22,14,Black/White/Anthracite
Made great and helps my back,Love these so comfortable for work standing 8 hrs +,5,2/15/22,7,Cool Grey/Anthracite-dark Grey
Nice shoes,COOL,5,4/27/22,11,Black/White/Anthracite
I love it is very comfortable.,The comfort,5,2/8/22,8,Cool Grey/Anthracite-dark Grey
Very pleased,Very pleased,5,4/18/22,11,Black/Anthracite/White